{
  "schemaVersion": 1,
  "id": "dev.kuml.plugin.codegen.cpp",
  "name": "C++ Code Generator",
  "version": "1.0.0",
  "kumlVersionRange": ">=0.12.0",
  "extensions": [
    {
      "category": "codegen",
      "implementation": "dev.kuml.plugin.examples.cpp.CppCodegenPlugin",
      "id": "cpp-codegen-plugin"
    }
  ],
  "permissions": ["fs.write"],
  "licenseSpdx": "Apache-2.0"
}
